Loc PackedFile	1
key	text	tooltip
unit_description_short_texts_text_ovn_unit_short_text_com_olorin_the_grey_wizard	An itinerant wanderer, the Grey Wizard Olorin is much admired in the Moot for his fireworks displays and even more so for his ability to pull rabbits out of a hat. Tasty rabbits, too. Olorin has a secret, but he's not telling.	true
unit_description_short_texts_text_ovn_unit_short_text_com_aragand_the_layabout	Aragand the Layabout is the type of bloke you see sitting in the corner of every tavern in the Empire. Alone, scruffy and unloved. He claims to be a King in waiting of a far off land.	true
unit_description_short_texts_text_ovn_unit_short_text_com_aragand_the_layabout_sober	Aragand the Layabout is in fact the true ruler of a petty kingdom in the Borderlands! Overthrown and exiled by an ambitious and cruel family member, he has been wandering the world ever since.	false
unit_description_short_texts_text_ovn_unit_short_text_com_legles_the_elf	Legles, out for his morning constitutional, was forcibly befriended by a hapless Dwarf, named Giblit. The two have formed an unlikely friendship.	true
unit_description_short_texts_text_ovn_unit_short_text_com_giblit_the_dwarf	Giblit is a failed Slayer. In absolute shame, his peers sent him out to befriend an Elf. This he did, much to the Elf's disgust.	true
